{
  "$schema": "https://json-schema.org/draft/2020-12/schema",
  "$id": "https://sounio.org/hardware/spec/eisa_h/pireus_operator_atlas_v1.schema.json",
  "title": "EISA-H PIREUS bilinear-phase operator atlas contract",
  "type": "object",
  "additionalProperties": false,
  "required": [
    "schema_version",
    "contract_id",
    "purpose",
    "algebra",
    "declared",
    "classification",
    "classifications",
    "error_codes",
    "receipt",
    "claim_boundary"
  ],
  "properties": {
    "schema_version": {
      "const": 1
    },
    "contract_id": {
      "const": "eisa_h.pireus_operator_atlas.v1"
    },
    "purpose": {
      "type": "string"
    },
    "algebra": {
      "type": "object"
    },
    "declared": {
      "type": "object"
    },
    "classification": {
      "type": "object"
    },
    "classifications": {
      "type": "array"
    },
    "error_codes": {
      "type": "array"
    },
    "receipt": {
      "type": "object"
    },
    "claim_boundary": {
      "type": "object"
    }
  }
}
